{
  "$schema": "https://json-schema.org/draft/2020-12/schema",
  "title": "Assessment manifest canonical payload",
  "description": "PLANNED /api/v1 target contract. This is not the running /api OpenAPI or proof of runtime enforcement.",
  "x-contract-status": "PLANNED",
  "type": "object",
  "additionalProperties": false,
  "properties": {
    "schema": {"const": "assessment_manifest_v1"},
    "tenant_id": {"$ref": "common.schema.json#/$defs/RegisteredId"},
    "change_id": {"$ref": "common.schema.json#/$defs/UUIDv4"},
    "preapproval_revision": {"$ref": "common.schema.json#/$defs/Revision"},
    "preapproval_snapshot_sha256": {"$ref": "common.schema.json#/$defs/SHA256"},
    "tenant_audit_checkpoint": {"$ref": "common.schema.json#/$defs/AuditCheckpoint"},
    "candidate_snapshot_ref": {"$ref": "common.schema.json#/$defs/PayloadRef"},
    "source_bundle_ref": {"$ref": "common.schema.json#/$defs/PayloadRef"},
    "dataset_ref": {"$ref": "common.schema.json#/$defs/PayloadRef"},
    "suite_ref": {"$ref": "common.schema.json#/$defs/PayloadRef"},
    "evaluator_ref": {"$ref": "common.schema.json#/$defs/PayloadRef"},
    "model_ref": {"anyOf": [{"$ref": "common.schema.json#/$defs/PayloadRef"}, {"type": "null"}]},
    "prompt_ref": {"anyOf": [{"$ref": "common.schema.json#/$defs/PayloadRef"}, {"type": "null"}]},
    "selected_run_id": {"$ref": "common.schema.json#/$defs/UUIDv4"},
    "run_refs": {"type": "array", "minItems": 1, "uniqueItems": true, "items": {"$ref": "common.schema.json#/$defs/RunRef"}},
    "decision_refs": {"type": "array", "minItems": 1, "uniqueItems": true, "items": {"$ref": "common.schema.json#/$defs/DecisionRef"}},
    "transition_refs": {"type": "array", "minItems": 1, "uniqueItems": true, "items": {"$ref": "common.schema.json#/$defs/TransitionRef"}},
    "source_eligibility_snapshot_ref": {"$ref": "common.schema.json#/$defs/PayloadRef"}
  },
  "required": [
    "schema",
    "tenant_id",
    "change_id",
    "preapproval_revision",
    "preapproval_snapshot_sha256",
    "tenant_audit_checkpoint",
    "candidate_snapshot_ref",
    "source_bundle_ref",
    "dataset_ref",
    "suite_ref",
    "evaluator_ref",
    "model_ref",
    "prompt_ref",
    "selected_run_id",
    "run_refs",
    "decision_refs",
    "transition_refs",
    "source_eligibility_snapshot_ref"
  ],
  "x-runtime-rules": [
    "Freeze p = preapproval_revision and the tenant checkpoint under the required locks.",
    "Include every change transition from genesis through p and its corresponding audit event; no transition after p.",
    "run_refs sort by (recorded_revision, id); decision_refs by (output_revision, id); transition_refs by revision_to.",
    "All prior committed runs, including failures, remain included; selected_run_id identifies the latest eligible run.",
    "References must resolve to the same tenant, exact immutable payload bytes and correct versioned object type.",
    "No release approval note, release transition, release event or envelope is in this preapproval payload."
  ],
  "x-hash-purpose": "assessment",
  "x-canonicalization": "caseproof.c14n.v1"
}
